<?xml version="1.0" encoding="UTF-8"?>
<setup  xmlns="http://net.mjahn.jenkins/schema/configruation/v1-0" 
		xmlns:xs="http://www.w3.org/2001/XMLSchema-instance" 
                xmlns:xsi="http://www.w3.org/2001/XMLSchema-instance"
                xsi:schemaLocation='http://net.mjahn.jenkins/schema/configruation/v1-0 ../../main/resources/configuration-1.0.xsd'>

    <name>test</name>
    <configuration alias="config1">
        <projectTriggers>
            <project>
                <name>cibuddy</name>
                <projectURL>http://localhost:8080/job/cibuddy%20masterbuild/</projectURL>
            </project>
            <trigger>
                <status>SUCCESS</status>
            </trigger>
        </projectTriggers>
        <statusIndicators>
            <statusIndicator>
                <id>0</id>
            </statusIndicator>
        </statusIndicators>
    </configuration>
</setup>
